{
  "id": "okstate_treaty_chicago_1833",
  "type": "website",
  "citation": "Oklahoma State University Libraries, Treaty with the Chippewa, etc., 1833 (transcription of the treaty text).",
  "date": "accessed 2026-09-02",
  "describes_date": "1833-09-26",
  "locator": "payment clause naming Gholson Kercheval of Chicago",
  "url": "https://treaties.okstate.edu/treaties/treaty-with-the-chippewa-etc-1833-0402",
  "tier": 1,
  "rights_status": "check_required",
  "asset_use": "text_only",
  "verified": true,
  "note": "Used for T-0479 to corroborate the exact name, Chicago designation and federal treaty-service payment; it does not establish a household or 1 July 1835 residence."
}
